{
	"$schema": "../board-definition.schema.json",
	"isToolboard": true,
	"name": "Orbitool O2",
	"manufacturer": "LDO",
	"id": "ldo-orbitool-o2",
	"firmwareBinaryName": "firmware-ldo-orbitool-o2.bin",
	"boardImageFileName": "board.webp",
	"compileScript": "compile.sh",
	"thermistorPullup": 2200,
	"flashScript": "flash.sh",
	"documentationLink": "https://os.ratrig.com/docs/boards/ldo/orbitool-o2",
	"disableAutoFlash": true,
	"driverVoltages": [24],
	"hasMcuTempSensor": true,
	"invertPinLogic": ["PA9"],
	"driverCount": 1,
	"integratedDrivers": {
		"extruder": "LDO-TMC2209"
	},
	"dfu": {
		"flashDevice": "0483:df11",
		"dfuBootImage": "dfubooting.webp",
		"instructions": [
			"Connect the board via USB to the Raspberry Pi",
			"Make sure the board is powered (you can use usb power by placing a jumper on the VBUS pins)",
			"Press and hold the BOOT button on the board.",
			"Press and release the RESET button on the board.",
			"Release the BOOT button."
		],
		"hasBoot0Jumper": false
	},
	"outputPins": [
		{
			"name": "_run_led",
			"pin": "PB8",
			"value": 1
		}
	],
	"hotendHeater": {
		"maxPower": { 
			"value": 0.995,
		    "comment": "The hotend heater power must be limited to 99.5% (max_power: 0.995) to enable the correct operation of Orbitool O2s protection features. Do not set max_power to a value greater than 0.995."
		},
		"pwmCycleTime": {
			"value": 0.01,
			"comment": "To improve the heater power calculation accuracy, the heater PWM is forced to 100Hz (instead of the 10Hz default of Klipper)."
		}
	},
	"partCoolingFan": {
		"inputVoltagePwmCycleTime": {
			"value": 0.02,
			"comment": "cycle_time as per Orbitool O2 example config"
		},
		"maxPower": { 
			"value": 0.995, 
			"comment": "The part fan power must be limited to 99.5% (max_power: 0.995) to enable the correct operation of Orbitool O2s protection features. Do not set max_power to a value greater than 0.995."
		}
	},
	"toolheadCoolingFan": {
		"maxPower": { 
			"value": 1,
			"comment": "Use max_power: 0.5 for 12V, max_power: 1 for 24V (in printer.cfg)" 
		},
		"inputVoltagePwmCycleTime": { 
			"value": 0.0001,
			"comment": "The Orbitool O2s DC-DC fan control circuit is designed for a command signal of 10khz. Do not change."
		}
	},
	"LIS2DW": {
		"cs_pin": "PA4",
		"hardware": {
			"bus": "spi1"
		},
		"axesMap": "y, z, x"
	},
	"customSections": {
		"adc_temperature": {
			"name": "orbitool_o2_hotend_power_scale",
			"isPerToolhead": false,
			"parameters": {
				"temperature1": 119,
				"voltage1": 1.91,
				"temperature2": 239,
				"voltage2": 3.82
			}
		},
	"temperature_sensor": {
			"name": "hotend_power",
			"parameters": {
				"sensor_pin": "PA2",
				"sensor_type": "orbitool_o2_hotend_power_scale"
			}
		}
	}
}
