{
	"$schema": "../board-definition.schema.json",
	"boardImageFileName": "board.webp",
	"manualFileName": "manual.pdf",
	"wireDiagramFileName": "wiring.drawio.svg",
	"name": "Manta M4P",
	"manufacturer": "BIGTREETECH",
	"id": "btt-manta-m4p",
	"firmwareBinaryName": "firmware-btt-manta-m4p.bin",
	"compileScript": "compile.sh",
	"flashScript": "flash.sh",
	"flashInstructions": "Flashing only works if the SD card slot on the Manta is empty.",
	"documentationLink": "https://os.ratrig.com/docs/boards/btt/manta-m4p-10",
	"driverCount": 4,
	"driverVoltages": [24, 36, 48, 56],
	"motorSlots": {
		"Extruder": {
			"title": "Extruder",
			"enable_pin": "PC7",
			"step_pin": "PC6",
			"dir_pin": "PA14",
			"uart_pin": "PB12",
			"cs_pin": "PB12",
			"diag_pin": "PC0",
			"endstop_pin": "PC0",
			"spi_software_mosi_pin": "PA7",
			"spi_software_miso_pin": "PA6",
			"spi_software_sclk_pin": "PA5"
		},
		"X": {
			"title": "X",
			"enable_pin": "PB11",
			"step_pin": "PB10",
			"dir_pin": "PB2",
			"uart_pin": "PC10",
			"cs_pin": "PC10",
			"diag_pin": "PC1",
			"endstop_pin": "PC1",
			"spi_software_mosi_pin": "PA7",
			"spi_software_miso_pin": "PA6",
			"spi_software_sclk_pin": "PA5"
		},
		"Y": {
			"title": "Y",
			"enable_pin": "PB1",
			"step_pin": "PB0",
			"dir_pin": "PC5",
			"uart_pin": "PC9",
			"cs_pin": "PC9",
			"diag_pin": "PC2",
			"endstop_pin": "PC2",
			"spi_software_mosi_pin": "PA7",
			"spi_software_miso_pin": "PA6",
			"spi_software_sclk_pin": "PA5"
		},
		"Z": {
			"title": "Z",
			"enable_pin": "PD5",
			"step_pin": "PB3",
			"dir_pin": "PB4",
			"uart_pin": "PA13",
			"cs_pin": "PA13",
			"diag_pin": "PC15",
			"endstop_pin": "PC15",
			"spi_software_mosi_pin": "PA7",
			"spi_software_miso_pin": "PA6",
			"spi_software_sclk_pin": "PA5"
		}
	},
	"ADXL345SPI": {
		"cs_pin": "PD9",
		"software": {
			"sclk": "PA5",
			"mosi": "PA7",
			"miso": "PA6"
		}
	},
	"stepperSPI": {
		"software": {
			"sclk": "PA5",
			"mosi": "PA7",
			"miso": "PA6"
		}
	}
}
