{
	"$schema": "../board-definition.schema.json",
	"manualFileName": "manual.pdf",
	"boardImageFileName": "board.png",
	"isToolboard": true,
	"name": "SB2209 USB v1.0 RP2040",
	"manufacturer": "BIGTREETECH",
	"id": "btt-sb-2209-usb-10-rp",
	"firmwareBinaryName": "firmware-btt-sb-2209-usb-10-rp.uf2",
	"compileScript": "compile.sh",
	"flashScript": "flash.sh",
	"documentationLink": "https://os.ratrig.com/docs/boards/btt/sb2209-usb-10",
	"fourPinFanConnectorCount": 1,
	"driverVoltages": [24],
	"hasMcuTempSensor": true,
	"outputPins": [
		{
			"name": "part_fan_power",
			"pin": "gpio14",
			"value": 0
		}
	],
	"driverCount": 1,
	"integratedDrivers": {
		"extruder": "BTT-TMC2209-13"
	},
	"dfu": {
		"flashDevice": "2e8a:0003",
		"dfuBootImage": "dfubooting.png",
		"instructions": [
			"Connect the toolboard via EBB USB Adapter to the Raspberry Pi.",
			"Verify the green LED is lit indicating the toolboard is powered.",
			"Press and hold the BOOT button on the toolboard.",
			"Press and release the RESET button on the toolboard.",
			"Release the BOOT button."
		],
		"hasBoot0Jumper": false
	},
	"LIS2DW": {
		"cs_pin": "gpio1",
		"hardware": {
			"bus": "spi0a"
		}
	}
}
