{
	"$schema": "../board-definition.schema.json",
	"boardImageFileName": "board.webp",
	"wireDiagramFileName": "wiring.drawio.svg",
	"isToolboard": true,
	"name": "FLY-SHT36",
	"manufacturer": "Mellow",
	"id": "mellow-fly-sht-36-v3",
	"firmwareBinaryName": "firmware-mellow-fly-sht-36-v3.uf2",
	"compileScript": "compile.sh",
	"flashScript": "flash.sh",
	"documentationLink": "https://os.ratrig.com/docs/boards/mellow/fly-sht-36-v3",
	"driverCount": 1,
	"integratedDrivers": {
		"extruder": "MELLOW-FLY-TMC2209"
	},
	"alternativePT1000Resistor": 1000,
	"dfu": {
		"flashDevice": "0483:ef11",
		"dfuBootImage": "dfubooting.webp",
		"instructions": [
			"Press and hold the BOOT button, then connect the USB to the host computer",
			"Make sure the board is powered on"
		],
		"hasBoot0Jumper": false
	},
	"ADXL345SPI": {
		"cs_pin": "gpio12",
		"hardware": {
			"bus": "spi1"
		}
	}
}
