{
	"$schema": "../board-definition.schema.json",
	"boardImageFileName": "board.webp",
	"name": "Einsy",
	"manufacturer": "Prusa",
	"id": "prusa-einsy",
	"firmwareBinaryName": "firmware-prusa-einsy.elf.hex",
	"driverCount": 4,
	"driverVoltages": [24],
	"hasMcuTempSensor": false,
	"fourPinFanConnectorCount": 2,
	"integratedDrivers": {
		"x": "PRUSA-EINSY-RAMBO-TMC2130",
		"y": "PRUSA-EINSY-RAMBO-TMC2130",
		"z": "PRUSA-EINSY-RAMBO-TMC2130",
		"extruder": "PRUSA-EINSY-RAMBO-TMC2130"
	},
	"compileScript": "compile.sh",
	"flashScript": "flash.sh",
	"documentationLink": "https://os.ratrig.com/docs/boards/prusa/einsy",
	"stepperSPI": {
		"hardware": {
			"bus": "spi"
		}
	},
	"stepperSPI": {
		"software": {
			"sclk": "PB1",
			"mosi": "PB2",
			"miso": "PB3"
		}
	},
	"motorSlots": {
		"X": {
			"title": "X",
			"enable_pin": "PA7",
			"step_pin": "PC0",
			"dir_pin": "PL0",
			"cs_pin": "PG0",
			"endstop_pin": "PK2",
			"diag_pin": "PK2",
			"spi_software_mosi_pin": "PB2",
			"spi_software_miso_pin": "PB3",
			"spi_software_sclk_pin": "PB1"
		},
		"Y": {
			"title": "Y",
			"enable_pin": "PA6",
			"step_pin": "PC1",
			"dir_pin": "PL1",
			"cs_pin": "PG2",
			"endstop_pin": "PK7",
			"diag_pin": "PK7",
			"spi_software_mosi_pin": "PB2",
			"spi_software_miso_pin": "PB3",
			"spi_software_sclk_pin": "PB1"
		},
		"Z": {
			"title": "Z",
			"enable_pin": "PA5",
			"step_pin": "PC2",
			"dir_pin": "PL2",
			"cs_pin": "PK5",
			"endstop_pin": "PK6",
			"diag_pin": "PK6",
			"spi_software_mosi_pin": "PB2",
			"spi_software_miso_pin": "PB3",
			"spi_software_sclk_pin": "PB1"
		},
		"E0": {
			"title": "E0",
			"enable_pin": "PA4",
			"step_pin": "PC3",
			"dir_pin": "PL6",
			"cs_pin": "PK4",
			"diag_pin": "PK3",
			"spi_software_mosi_pin": "PB2",
			"spi_software_miso_pin": "PB3",
			"spi_software_sclk_pin": "PB1"
		}
	}
}
