{
	"$schema": "../board-definition.schema.json",
	"isToolboard": true,
	"name": "Caramba",
	"manufacturer": "Ay",
	"id": "ay-caramba",
	"firmwareBinaryName": "firmware-caramba.bin",
	"compileScript": "compile.sh",
	"flashScript": "flash.sh",
	"documentationLink": "https://os.ratrig.com/docs/toolboards/documentation-pending",
	"fourPinFanConnectorCount": 1,
	"disableAutoFlash": true,
	"driverVoltages": [24],
	"hasMcuTempSensor": true,
	"outputPins": [
		{
			"name": "part_fan_power",
			"pin": "PA10",
			"value": 0
		}
	],
	"driverCount": 1,
	"integratedDrivers": {
		"extruder": "LDO-TMC2209"
	},
	"dfu": {
		"flashDevice": "0483:df11",
		"dfuBootImage": "dfubooting.png",
		"instructions": [
			"Connect the board via USB to the Raspberry Pi",
			"Make sure the board is powered (you can use usb power by placing a jumper on the VBUS pins)",
			"Press and hold the BOOT button on the board.",
			"Press and release the RESET button on the board.",
			"Release the BOOT button."
		],
		"hasBoot0Jumper": false
	},
	"LIS2DW": {
		"cs_pin": "PA4",
		"software": {
			"sclk": "PA5",
			"mosi": "PA7",
			"miso": "PA6"
		}
	}
}
